{"schema_version":"1","analysis_rev":"fx-0001","producer_commit":"w0-fixture","input_artifact_hashes":{},"scene_key":"fl-pie-fixture-01","records":[{"record_id":"c_780c1e66362f","task":"C1","t_ms":6000,"cam_id":"dashcam","actor_refs":[{"scene_key":"fl-pie-fixture-01","entity_id":"P1","kind":"person"}],"input_frame_refs":[{"cam_id":"dashcam","t_ms":3000},{"cam_id":"dashcam","t_ms":3250},{"cam_id":"dashcam","t_ms":3500},{"cam_id":"dashcam","t_ms":3750},{"cam_id":"dashcam","t_ms":4000},{"cam_id":"dashcam","t_ms":4250},{"cam_id":"dashcam","t_ms":4500},{"cam_id":"dashcam","t_ms":4750},{"cam_id":"dashcam","t_ms":5000},{"cam_id":"dashcam","t_ms":5250},{"cam_id":"dashcam","t_ms":5500},{"cam_id":"dashcam","t_ms":5750},{"cam_id":"dashcam","t_ms":6000},{"cam_id":"dashcam","t_ms":6250},{"cam_id":"dashcam","t_ms":6500},{"cam_id":"dashcam","t_ms":6750},{"cam_id":"dashcam","t_ms":7000},{"cam_id":"dashcam","t_ms":7250},{"cam_id":"dashcam","t_ms":7500},{"cam_id":"dashcam","t_ms":7750},{"cam_id":"dashcam","t_ms":8000},{"cam_id":"dashcam","t_ms":8250},{"cam_id":"dashcam","t_ms":8500},{"cam_id":"dashcam","t_ms":8750}],"prefix_only":false,"model_rev":"cosmos3-nano-reasoner@fixture","prompt_rev":"fx-prompt-1","payload":{"label":"crossing","reason":"The pedestrian walks across the lane in front of the car.","uncertainty":0.15},"raw":null,"verification":{"status":"verified","method":"situation_map rule pie_crossing","ref":null}},{"record_id":"c_e8c7f0fc0b20","task":"C2","t_ms":5000,"cam_id":"dashcam","actor_refs":[{"scene_key":"fl-pie-fixture-01","entity_id":"P1","kind":"person"}],"input_frame_refs":[{"cam_id":"dashcam","t_ms":3000},{"cam_id":"dashcam","t_ms":3250},{"cam_id":"dashcam","t_ms":3500},{"cam_id":"dashcam","t_ms":3750},{"cam_id":"dashcam","t_ms":4000},{"cam_id":"dashcam","t_ms":4250},{"cam_id":"dashcam","t_ms":4500},{"cam_id":"dashcam","t_ms":4750}],"prefix_only":true,"model_rev":"cosmos3-nano-reasoner@fixture","prompt_rev":"fx-prompt-1","payload":{"actions":["slow","stop"],"reason":"A pedestrian is entering the lane ahead.","horizon_s":2,"max_frame_ms":4750,"actual":{"actions":["slow"],"source":"trip speed"},"ghost":null},"raw":null,"verification":{"status":"verified","method":"c2 rule vs OBD speed","ref":null}},{"record_id":"c_81327df12591","task":"C4","t_ms":6000,"cam_id":"dashcam","actor_refs":[{"scene_key":"fl-pie-fixture-01","entity_id":"P1","kind":"person"}],"input_frame_refs":[{"cam_id":"dashcam","t_ms":3000},{"cam_id":"dashcam","t_ms":3250},{"cam_id":"dashcam","t_ms":3500},{"cam_id":"dashcam","t_ms":3750},{"cam_id":"dashcam","t_ms":4000},{"cam_id":"dashcam","t_ms":4250},{"cam_id":"dashcam","t_ms":4500},{"cam_id":"dashcam","t_ms":4750},{"cam_id":"dashcam","t_ms":5000},{"cam_id":"dashcam","t_ms":5250},{"cam_id":"dashcam","t_ms":5500},{"cam_id":"dashcam","t_ms":5750},{"cam_id":"dashcam","t_ms":6000},{"cam_id":"dashcam","t_ms":6250},{"cam_id":"dashcam","t_ms":6500},{"cam_id":"dashcam","t_ms":6750},{"cam_id":"dashcam","t_ms":7000},{"cam_id":"dashcam","t_ms":7250},{"cam_id":"dashcam","t_ms":7500},{"cam_id":"dashcam","t_ms":7750},{"cam_id":"dashcam","t_ms":8000},{"cam_id":"dashcam","t_ms":8250},{"cam_id":"dashcam","t_ms":8500},{"cam_id":"dashcam","t_ms":8750}],"prefix_only":false,"model_rev":"cosmos3-nano-reasoner@fixture","prompt_rev":"fx-prompt-1","payload":{"query":"when does the pedestrian step into the lane","segments":[{"start_s":5.2,"end_s":7.9,"text":"pedestrian in lane"}]},"raw":null,"verification":{"status":"unverified","method":"no truth for this query","ref":null}},{"record_id":"c_c73f2e8e0d1b","task":"C5","t_ms":2000,"cam_id":"dashcam","actor_refs":[],"input_frame_refs":[{"cam_id":"dashcam","t_ms":2000}],"prefix_only":false,"model_rev":"cosmos3-nano-reasoner@fixture","prompt_rev":"fx-prompt-1","payload":{"region_ref":"w1001","text":"Brick facade with a cafe sign at street level.","sign_text":"FIXTURE CAFE"},"raw":null,"verification":{"status":"conflict","method":"sign vs OSM name","ref":null}}]}
