{"schema_version":"1","analysis_rev":"fx-0001","producer_commit":"w0-fixture","input_artifact_hashes":{},"scene_key":"wh-sdg-fixture-01","records":[{"record_id":"c_0d6a1cd60734","task":"C1","t_ms":4600,"cam_id":"ceiling_04","actor_refs":[{"scene_key":"wh-sdg-fixture-01","entity_id":"P1","kind":"person"},{"scene_key":"wh-sdg-fixture-01","entity_id":"F1","kind":"forklift"}],"input_frame_refs":[{"cam_id":"ceiling_04","t_ms":1600},{"cam_id":"ceiling_04","t_ms":1850},{"cam_id":"ceiling_04","t_ms":2100},{"cam_id":"ceiling_04","t_ms":2350},{"cam_id":"ceiling_04","t_ms":2600},{"cam_id":"ceiling_04","t_ms":2850},{"cam_id":"ceiling_04","t_ms":3100},{"cam_id":"ceiling_04","t_ms":3350},{"cam_id":"ceiling_04","t_ms":3600},{"cam_id":"ceiling_04","t_ms":3850},{"cam_id":"ceiling_04","t_ms":4100},{"cam_id":"ceiling_04","t_ms":4350},{"cam_id":"ceiling_04","t_ms":4600},{"cam_id":"ceiling_04","t_ms":4850},{"cam_id":"ceiling_04","t_ms":5100},{"cam_id":"ceiling_04","t_ms":5350},{"cam_id":"ceiling_04","t_ms":5600},{"cam_id":"ceiling_04","t_ms":5850},{"cam_id":"ceiling_04","t_ms":6100},{"cam_id":"ceiling_04","t_ms":6350},{"cam_id":"ceiling_04","t_ms":6600},{"cam_id":"ceiling_04","t_ms":6850},{"cam_id":"ceiling_04","t_ms":7100},{"cam_id":"ceiling_04","t_ms":7350}],"prefix_only":false,"model_rev":"cosmos3-nano-reasoner@fixture","prompt_rev":"fx-prompt-1","payload":{"label":"yielding","reason":"The worker steps sideways away from the forklift as it approaches.","uncertainty":0.2},"raw":null,"verification":{"status":"verified","method":"situation_map rule wh_dodge","ref":"labels/wh-sdg-fixture-01.json"}},{"record_id":"c_520cb6616154","task":"C2","t_ms":4500,"cam_id":"ceiling_04","actor_refs":[{"scene_key":"wh-sdg-fixture-01","entity_id":"F1","kind":"forklift"}],"input_frame_refs":[{"cam_id":"ceiling_04","t_ms":2500},{"cam_id":"ceiling_04","t_ms":2750},{"cam_id":"ceiling_04","t_ms":3000},{"cam_id":"ceiling_04","t_ms":3250},{"cam_id":"ceiling_04","t_ms":3500},{"cam_id":"ceiling_04","t_ms":3750},{"cam_id":"ceiling_04","t_ms":4000},{"cam_id":"ceiling_04","t_ms":4250}],"prefix_only":true,"model_rev":"cosmos3-nano-reasoner@fixture","prompt_rev":"fx-prompt-1","payload":{"actions":["continue"],"reason":"The forklift keeps a steady heading with no braking cue.","horizon_s":2,"max_frame_ms":4250,"actual":{"actions":["continue"],"source":"forklift.json gt speed"},"ghost":[[4500,1.4,-2.5],[5000,1.0,-2.5],[5500,0.6,-2.5],[6000,0.2,-2.5],[6500,-0.2,-2.5]]},"raw":null,"verification":{"status":"verified","method":"c2 rule vs forklift gt","ref":"labels/wh-sdg-fixture-01.json"}},{"record_id":"c_14a596195f3d","task":"C3","t_ms":4500,"cam_id":"ceiling_00","actor_refs":[],"input_frame_refs":[{"cam_id":"ceiling_00","t_ms":1500},{"cam_id":"ceiling_00","t_ms":1750},{"cam_id":"ceiling_00","t_ms":2000},{"cam_id":"ceiling_00","t_ms":2250},{"cam_id":"ceiling_00","t_ms":2500},{"cam_id":"ceiling_00","t_ms":2750},{"cam_id":"ceiling_00","t_ms":3000},{"cam_id":"ceiling_00","t_ms":3250},{"cam_id":"ceiling_00","t_ms":3500},{"cam_id":"ceiling_00","t_ms":3750},{"cam_id":"ceiling_00","t_ms":4000},{"cam_id":"ceiling_00","t_ms":4250},{"cam_id":"ceiling_00","t_ms":4500},{"cam_id":"ceiling_00","t_ms":4750},{"cam_id":"ceiling_00","t_ms":5000},{"cam_id":"ceiling_00","t_ms":5250},{"cam_id":"ceiling_00","t_ms":5500},{"cam_id":"ceiling_00","t_ms":5750},{"cam_id":"ceiling_00","t_ms":6000},{"cam_id":"ceiling_00","t_ms":6250},{"cam_id":"ceiling_00","t_ms":6500},{"cam_id":"ceiling_00","t_ms":6750},{"cam_id":"ceiling_00","t_ms":7000},{"cam_id":"ceiling_00","t_ms":7250}],"prefix_only":false,"model_rev":"cosmos3-nano-reasoner@fixture","prompt_rev":"fx-prompt-1","payload":{"objects":[{"label":"shelf","box_0_1000":[470.6,170.8,694.9,518.5],"ground_poly":[[2.5,1.4],[2.5,0.6],[-0.5,0.6],[-0.5,1.4]],"depth_residual_m":0.12,"geometric_support":true}]},"raw":null,"verification":{"status":"verified","method":"depth ray test","ref":null}},{"record_id":"c_7001de69940a","task":"C4","t_ms":4500,"cam_id":"ceiling_04","actor_refs":[{"scene_key":"wh-sdg-fixture-01","entity_id":"P1","kind":"person"}],"input_frame_refs":[{"cam_id":"ceiling_04","t_ms":1500},{"cam_id":"ceiling_04","t_ms":1750},{"cam_id":"ceiling_04","t_ms":2000},{"cam_id":"ceiling_04","t_ms":2250},{"cam_id":"ceiling_04","t_ms":2500},{"cam_id":"ceiling_04","t_ms":2750},{"cam_id":"ceiling_04","t_ms":3000},{"cam_id":"ceiling_04","t_ms":3250},{"cam_id":"ceiling_04","t_ms":3500},{"cam_id":"ceiling_04","t_ms":3750},{"cam_id":"ceiling_04","t_ms":4000},{"cam_id":"ceiling_04","t_ms":4250},{"cam_id":"ceiling_04","t_ms":4500},{"cam_id":"ceiling_04","t_ms":4750},{"cam_id":"ceiling_04","t_ms":5000},{"cam_id":"ceiling_04","t_ms":5250},{"cam_id":"ceiling_04","t_ms":5500},{"cam_id":"ceiling_04","t_ms":5750},{"cam_id":"ceiling_04","t_ms":6000},{"cam_id":"ceiling_04","t_ms":6250},{"cam_id":"ceiling_04","t_ms":6500},{"cam_id":"ceiling_04","t_ms":6750},{"cam_id":"ceiling_04","t_ms":7000},{"cam_id":"ceiling_04","t_ms":7250}],"prefix_only":false,"model_rev":"cosmos3-nano-reasoner@fixture","prompt_rev":"fx-prompt-1","payload":{"query":"when does the worker start yielding","segments":[{"start_s":4.75,"end_s":5.6,"text":"worker steps back"}]},"raw":null,"verification":{"status":"verified","method":"start error vs first Dodge frame = 0.15 s","ref":"labels/wh-sdg-fixture-01.json"}},{"record_id":"c_3ae4f6b88db8","task":"C5","t_ms":4500,"cam_id":"eye_00","actor_refs":[{"scene_key":"wh-sdg-fixture-01","entity_id":"F1","kind":"forklift"}],"input_frame_refs":[{"cam_id":"eye_00","t_ms":1500},{"cam_id":"eye_00","t_ms":1750},{"cam_id":"eye_00","t_ms":2000},{"cam_id":"eye_00","t_ms":2250},{"cam_id":"eye_00","t_ms":2500},{"cam_id":"eye_00","t_ms":2750},{"cam_id":"eye_00","t_ms":3000},{"cam_id":"eye_00","t_ms":3250},{"cam_id":"eye_00","t_ms":3500},{"cam_id":"eye_00","t_ms":3750},{"cam_id":"eye_00","t_ms":4000},{"cam_id":"eye_00","t_ms":4250},{"cam_id":"eye_00","t_ms":4500},{"cam_id":"eye_00","t_ms":4750},{"cam_id":"eye_00","t_ms":5000},{"cam_id":"eye_00","t_ms":5250},{"cam_id":"eye_00","t_ms":5500},{"cam_id":"eye_00","t_ms":5750}],"prefix_only":false,"model_rev":"cosmos3-nano-reasoner@fixture","prompt_rev":"fx-prompt-1","payload":{"region_ref":"F1","text":"A yellow counterbalance forklift with forks lowered, moving left.","sign_text":null},"raw":null,"verification":{"status":"unverified","method":"no labels","ref":null}}]}
